{
  "$schema": "https://lloom.dev/schemas/recipe-index.v1.schema.json",
  "schemaVersion": 1,
  "profile": "https://lloom.dev/profiles/interchange/v1",
  "id": "lloom-community-host-recipes",
  "name": "LLooM Community Host Seed Recipes",
  "summary": "Seed catalog for the local LLooM development community host.",
  "license": {
    "id": "MIT",
    "name": "Recipe metadata license"
  },
  "updatedAt": "2026-07-08T00:00:00.000Z",
  "provenance": {
    "createdBy": "lloom",
    "generatedBy": "manual-curated"
  },
  "recipes": [
    {
      "id": "apple-silicon-qwen36-35b-a3b-optiq",
      "path": "apple-silicon-qwen36-35b-a3b-optiq.json",
      "name": "Apple Silicon Qwen3.6 35B-A3B OptiQ (official)",
      "summary": "Official-faithful Qwen3.6-35B-A3B via mlx-community OptiQ mixed 4/8-bit + mlx_lm.server (no MTPLX Speed fork).",
      "tags": [
        "apple-silicon",
        "qwen3.6",
        "moe",
        "optiq",
        "mlx",
        "official",
        "agentic-coding",
        "coding-agent",
        "reasoning",
        "long-context"
      ],
      "recommendedFor": [
        "M-series Macs with at least 48 GB unified memory",
        "agentic chat/coding that should match stock Qwen3.6 behavior",
        "users who hit thought-loops or memory thrash on MTPLX Speed FP16"
      ],
      "capabilities": [
        "chat",
        "streaming",
        "tools",
        "reasoning",
        "long-context"
      ],
      "source": {
        "type": "lloom-host-seed",
        "url": "community/recipes/apple-silicon-qwen36-35b-a3b-optiq.json"
      }
    },
    {
      "id": "apple-silicon-qwen36-35b-a3b-mtplx",
      "path": "apple-silicon-qwen36-35b-a3b-mtplx.json",
      "name": "Apple Silicon Qwen3.6 35B-A3B MTPLX",
      "summary": "High-memory Apple Silicon Qwen3.6 MoE lane using MTPLX with 262K context.",
      "tags": [
        "apple-silicon",
        "qwen3.6",
        "moe",
        "mtplx",
        "agentic-coding",
        "coding-agent",
        "reasoning",
        "long-context"
      ],
      "recommendedFor": [
        "M-series Macs with at least 80 GB unified memory",
        "agentic coding workloads where the fastest observed Qwen3.6 lane matters"
      ],
      "capabilities": [
        "chat",
        "responses",
        "anthropic-messages",
        "streaming",
        "tools",
        "reasoning",
        "mtp",
        "long-context"
      ],
      "source": {
        "type": "lloom-host-seed",
        "url": "community/recipes/apple-silicon-qwen36-35b-a3b-mtplx.json"
      }
    },
    {
      "id": "apple-silicon-qwen36-27b-mtplx",
      "path": "apple-silicon-qwen36-27b-mtplx.json",
      "name": "Apple Silicon Qwen3.6 27B MTPLX",
      "summary": "Dense Qwen3.6 27B MTPLX lane for Apple Silicon machines that need lower memory pressure.",
      "tags": [
        "apple-silicon",
        "qwen3.6",
        "dense",
        "mtplx",
        "agentic-coding",
        "coding-agent",
        "reasoning",
        "long-context"
      ],
      "recommendedFor": [
        "M-series Macs with at least 48 GB unified memory",
        "agentic coding workloads that need long context with less memory pressure"
      ],
      "capabilities": [
        "chat",
        "responses",
        "anthropic-messages",
        "streaming",
        "tools",
        "reasoning",
        "mtp",
        "long-context"
      ],
      "source": {
        "type": "lloom-host-seed",
        "url": "community/recipes/apple-silicon-qwen36-27b-mtplx.json"
      }
    },
    {
      "id": "linux-nvidia-qwen36-27b-nvfp4-vllm",
      "path": "linux-nvidia-qwen36-27b-nvfp4-vllm.json",
      "name": "Linux NVIDIA Qwen3.6 27B NVFP4 vLLM",
      "summary": "CUDA/NVIDIA Qwen3.6 27B NVFP4 lane using vLLM with long context, prefix caching, tool calls, Qwen reasoning, and MTP speculative decoding.",
      "tags": [
        "linux",
        "nvidia",
        "cuda",
        "qwen3.6",
        "dense",
        "nvfp4",
        "vllm",
        "agentic-coding",
        "coding-agent",
        "reasoning",
        "long-context"
      ],
      "recommendedFor": [
        "Linux NVIDIA CUDA machines with at least 96 GB memory",
        "DGX Spark / GB10 class local inference setups",
        "agentic coding workloads that need Qwen reasoning, tool calls, batching, and long context"
      ],
      "capabilities": [
        "chat",
        "responses",
        "anthropic-messages",
        "streaming",
        "tools",
        "reasoning",
        "mtp",
        "batching",
        "long-context"
      ],
      "source": {
        "type": "lloom-host-seed",
        "url": "community/recipes/linux-nvidia-qwen36-27b-nvfp4-vllm.json"
      }
    },
    {
      "id": "linux-nvidia-qwen36-35b-a3b-fp8-vllm",
      "path": "linux-nvidia-qwen36-35b-a3b-fp8-vllm.json",
      "name": "Linux NVIDIA Qwen3.6 35B-A3B FP8 vLLM",
      "summary": "CUDA/NVIDIA Qwen3.6 35B-A3B MoE lane using vLLM — primary DGX Spark / GB10 agent default for throughput, tools, and long context.",
      "tags": [
        "linux",
        "nvidia",
        "cuda",
        "qwen3.6",
        "moe",
        "fp8",
        "vllm",
        "agentic-coding",
        "coding-agent",
        "reasoning",
        "long-context",
        "dgx-spark"
      ],
      "recommendedFor": [
        "DGX Spark / GB10 class local inference setups",
        "Linux NVIDIA CUDA machines with at least 96 GB memory",
        "agentic coding with Qwen MoE quality and tool calls"
      ],
      "capabilities": [
        "chat",
        "responses",
        "anthropic-messages",
        "streaming",
        "tools",
        "reasoning",
        "batching",
        "long-context"
      ],
      "source": {
        "type": "lloom-host-seed",
        "url": "community/recipes/linux-nvidia-qwen36-35b-a3b-fp8-vllm.json"
      }
    },
    {
      "id": "linux-nvidia-qwen36-27b-sglang",
      "path": "linux-nvidia-qwen36-27b-sglang.json",
      "name": "Linux NVIDIA Qwen3.6 27B SGLang",
      "summary": "CUDA/NVIDIA Qwen3.6 27B dense lane using SGLang for agent/tool loops and prefix-cache-heavy sessions on Spark-class hardware.",
      "tags": [
        "linux",
        "nvidia",
        "cuda",
        "qwen3.6",
        "dense",
        "sglang",
        "agentic-coding",
        "coding-agent",
        "prefix-cache",
        "long-context",
        "dgx-spark"
      ],
      "recommendedFor": [
        "DGX Spark / GB10 when agent multi-turn prefix reuse matters",
        "Linux NVIDIA machines preferring SGLang over vLLM for tool loops"
      ],
      "capabilities": [
        "chat",
        "responses",
        "anthropic-messages",
        "streaming",
        "tools",
        "reasoning",
        "batching",
        "long-context"
      ],
      "source": {
        "type": "lloom-host-seed",
        "url": "community/recipes/linux-nvidia-qwen36-27b-sglang.json"
      }
    }
  ]
}
